{
  "version": 1,
  "claim": "The full CI gate sequence (check:plugins, typecheck, npm test — the exact CI commands) passes green on branch work/bro-1qpk.4 with the OpenCode V2 + TUI plugin changes applied.",
  "slug": "ci-suite-green",
  "agent": "devin-cli",
  "session_id": "devin-bro-1qpk.4",
  "produced_at": "2026-10-06T02:05:00Z",
  "target_environment": "test-suite",
  "verification_method": "test-suite",
  "preconditions": [
    "worktree /home/pepl/projects/bro--bro-1qpk.4 on branch work/bro-1qpk.4, rebased onto origin/main",
    "all bro-1qpk.4 changes present: opencode.ts V2 setup, opencode-tui.ts, plugins.ts extras, connectors.ts preTool, hooks.ts pre-tool dispatch, generated plugins/opencode/bro/{bro.ts,cli.ts,README.md}",
    "node_modules refreshed via npm install (workspace links + @kilocode/plugin present)"
  ],
  "commands": [
    {
      "cmd": "npm test",
      "cwd": "/home/pepl/projects/bro--bro-1qpk.4",
      "exit_code": 0,
      "duration_ms": 113000,
      "stdout_excerpt": "NX   Successfully ran target test for 15 projects and 15 tasks they depend on",
      "stderr_excerpt": ""
    },
    {
      "cmd": "npm run typecheck",
      "cwd": "/home/pepl/projects/bro--bro-1qpk.4",
      "exit_code": 0,
      "duration_ms": 14300,
      "stdout_excerpt": "NX   Successfully ran target typecheck for 15 projects and 14 tasks they depend on",
      "stderr_excerpt": ""
    },
    {
      "cmd": "npm run check:plugins",
      "cwd": "/home/pepl/projects/bro--bro-1qpk.4",
      "exit_code": 0,
      "duration_ms": 400,
      "stdout_excerpt": "plugin adapters fresh",
      "stderr_excerpt": ""
    },
    {
      "cmd": "npm run check:embedded",
      "cwd": "/home/pepl/projects/bro--bro-1qpk.4",
      "exit_code": 0,
      "duration_ms": 300,
      "stdout_excerpt": "embedded snapshot is current: 40 skill file(s), 2 formula(s)",
      "stderr_excerpt": ""
    }
  ],
  "assertions": [
    {
      "name": "npm-test-all-projects-green",
      "passed": true,
      "evidence_quote": "NX   Successfully ran target test for 15 projects and 15 tasks they depend on"
    },
    {
      "name": "typecheck-clean",
      "passed": true,
      "evidence_quote": "NX   Successfully ran target typecheck for 15 projects and 14 tasks they depend on"
    },
    {
      "name": "generated-plugins-drift-free",
      "passed": true,
      "evidence_quote": "plugin adapters fresh"
    },
    {
      "name": "embedded-snapshot-current",
      "passed": true,
      "evidence_quote": "embedded snapshot is current: 40 skill file(s), 2 formula(s)"
    }
  ],
  "files_changed": [
    "/home/pepl/projects/bro--bro-1qpk.4/packages/cli/src/opencode.ts",
    "/home/pepl/projects/bro--bro-1qpk.4/packages/cli/src/opencode-tui.ts",
    "/home/pepl/projects/bro--bro-1qpk.4/packages/cli/src/opencode-v2.test.ts",
    "/home/pepl/projects/bro--bro-1qpk.4/packages/cli/src/opencode-tui.test.ts",
    "/home/pepl/projects/bro--bro-1qpk.4/packages/cli/src/commands/plugins.ts",
    "/home/pepl/projects/bro--bro-1qpk.4/packages/cli/src/commands/plugins.test.ts",
    "/home/pepl/projects/bro--bro-1qpk.4/packages/cli/src/commands/hooks.ts",
    "/home/pepl/projects/bro--bro-1qpk.4/packages/cli/src/commands/hooks.e2e.test.ts",
    "/home/pepl/projects/bro--bro-1qpk.4/packages/cli/src/commands/doctor.ts",
    "/home/pepl/projects/bro--bro-1qpk.4/packages/cli/package.json",
    "/home/pepl/projects/bro--bro-1qpk.4/packages/cli/tsdown.config.ts",
    "/home/pepl/projects/bro--bro-1qpk.4/packages/core/src/connectors.ts",
    "/home/pepl/projects/bro--bro-1qpk.4/packages/core/src/connectors.test.ts",
    "/home/pepl/projects/bro--bro-1qpk.4/packages/core/src/index.ts",
    "/home/pepl/projects/bro--bro-1qpk.4/scripts/gen-plugins.ts",
    "/home/pepl/projects/bro--bro-1qpk.4/plugins/opencode/bro/bro.ts",
    "/home/pepl/projects/bro--bro-1qpk.4/plugins/opencode/bro/cli.ts",
    "/home/pepl/projects/bro--bro-1qpk.4/plugins/opencode/bro/README.md",
    "/home/pepl/projects/bro--bro-1qpk.4/specs/bro-1qpk.4.md",
    "/home/pepl/projects/bro--bro-1qpk.4/specs/bro-1qpk.4.1.md",
    "/home/pepl/projects/bro--bro-1qpk.4/specs/bro-1qpk.4.2.md",
    "/home/pepl/projects/bro--bro-1qpk.4/specs/bro-1qpk.4.3.md",
    "/home/pepl/projects/bro--bro-1qpk.4/specs/bro-1qpk.4.4.md"
  ],
  "artifacts": [
    {
      "kind": "log",
      "path": "out.stdout",
      "sha256": "7d6880fde2429a11fa367286758ca2ae7baf48696edcd23135bea5691c445269"
    },
    {
      "kind": "log",
      "path": "typecheck.stdout",
      "sha256": "c7c4b3498d94a1896304cded6c2715b72de7e20690060a7449bd46724f5a0297"
    },
    {
      "kind": "log",
      "path": "plugins.stdout",
      "sha256": "c1abb5ab7161b495a8812c4bc996420585887181cb1205711e1f2c5c7d3be1ba"
    },
    {
      "kind": "log",
      "path": "embedded.stdout",
      "sha256": "30634290ffbdfc88f468b5f805458fb98f6ee911e972d633fabe4caa6dd10275"
    }
  ],
  "remaining_gaps": [
    "nx test summary suppresses per-test counts in the captured log; per-file green for the two new test files was verified in a prior run (34 tests, 0 failures, exit 0) but is not quoted inside out.stdout",
    "TUI behavior asserted against a structural ctx stub, not a live OpenCode process — the real @opencode/plugin/tui package is not installed in this repo"
  ],
  "self_recheck": {
    "performed": true,
    "performed_at": "2026-10-06T02:06:00Z",
    "method": "re-read-file",
    "result": "still-holds"
  }
}
